director_name,actor_1_name,actor_2_name,actor_3_name,genres,movie_title,plot_keywords,language
harold becker,al pacino,martin landau,bridget fonda,drama thriller,city hall,drug dealer mayor new york city probation scandal,english
paul verhoeven,bobbie phillips,elizabeth berkley,robert davi,drama,showgirls,cult film lap dance lap dancing stripper striptease,english
sofia coppola,kirsten dunst,shirley henderson,rip torn,biography drama history romance,marie antoinette,austria cake france queen versailles,english
barbet schroeder,nicolas cage,michael rapaport,philip baker hall,action crime thriller,kiss of death,beard female nudity police brutality stripper woman in lingerie,english
stephen kay,sylvester stallone,miranda richardson,lauren lee smith,action crime drama thriller,get carter,affair car crash enforcer funeral murder,english
j.a. bayona,naomi watts,geraldine chaplin,oaklee pendergast,drama thriller,the impossible,christmas resort thailand tourist tsunami,english
elaine may,carol kane,warren beatty,isabelle adjani,action adventure comedy music thriller,ishtar,cia emir hotel map morocco,english
wes anderson,bill murray,meryl streep,helen mccrory,adventure animation comedy crime family,fantastic mr. fox,cider farm farmer fox tale,english
stephen herek,angelina jolie pitt,stockard channing,james gammon,comedy romance,life or something like it,football homeless man interview psychic reporter,english
john carpenter,richard epcar,michael mckean,patricia heaton,comedy romance sci-fi thriller,memoirs of an invisible man,accident bar chase cia laboratory,english
jean-pierre jeunet,mathieu kassovitz,jamel debbouze,isabelle nanty,comedy romance,amélie,cheerfulness female protagonist garden gnome magical realism waitress,french
dennie gordon,mary-kate olsen,bob saget,riley smith,comedy crime family romance,new york minute,dog new york city scholarship senator twin,english
charles shyer,omar epps,nia long,jane krakowski,comedy drama romance,alfie,best friend commitment friend limousine driver one night stand,english
ken kwapis,ted danson,tim blake nelson,andrew daly,biography drama romance,big miracle,arctic circle reporter small town volunteer whale,english
ulu grosbard,alexa penavega,treat williams,jonathan jackson,drama,the deep end of the ocean,basketball boy italian kidnapping a child reunion,english
william malone,natascha mcelhone,jeffrey combs,udo kier,crime horror thriller,feardotcom,bondage gear bound and gagged hung by one's wrists tied to a chair tied to a table,english
paul weitz,josh hutcherson,salma hayek,patrick fugit,action adventure fantasy thriller,cirque du freak: the vampire's assistant,antidote based on young adult novel flyer spider vampire,english
paul mcguigan,daniel radcliffe,spencer wilding,daniel mays,drama horror sci-fi thriller,victor frankenstein,assistant experiment frankenstein medical student scientist,english
danny devito,justin theroux,amber valletta,harvey fierstein,comedy,duplex,christmas duplex television tenant writer,english
malcolm d. lee,bernie mac,sean hayes,mike epps,comedy drama music,soul men,band masturbation reunion singer tribute,english
jerry jameson,m. emmet walsh,jason robards,anne archer,action adventure drama thriller,raise the titanic,military mineral ocean ship titanic,english
mic rodgers,michael jai white,daniel von bargen,xander berkeley,action sci-fi,universal soldier: the return,combat computer general military reporter,english
christian alvart,norman reedus,dennis quaid,eddie rouse,action horror mystery sci-fi thriller,pandorum,future mission space spaceship survival,english
gary fleder,gary dourdan,mekhi phifer,tim guinee,drama mystery sci-fi thriller,impostor,alien android bomb future weapon,english
christian duguay,rufus sewell,bridgette wilson-sampras,rupert graves,action adventure thriller,extreme ops,commercial extreme sports mountain serbian terrorist,english
jean-marie poiré,bridgette wilson-sampras,matt ross,john aylward,comedy fantasy sci-fi,just visiting,alternate history alternate timeline flatulence future time travel time travel comedy,english
danny boyle,chris evans,benedict wong,troy garity,adventure sci-fi thriller,sunshine,astronaut earth future icarus sun,english
brian robbins,john gatins,lou saliba,greg collins,comedy drama,a thousand words,box office flop buddhist liar literary agent magical tree,english
marc f. adler,eric idle,anne bancroft,kelly ripa,adventure animation comedy fantasy romance,delgo,box office flop computer animation one word title surrealism villainess,english
pierre morel,ray winstone,mark rylance,jasmine trinca,action crime drama mystery thriller,the gunman,assassination blood vomiting death hit squad mercenary,english
geoffrey sax,alex pettyfer,sophie okonedo,ashley walters,action adventure family thriller,alex rider: operation stormbreaker,14 year old british gadget spy training,english
d.j. caruso,sarah roemer,aaron yoo,jose pablo cantillo,drama mystery thriller,disturbia,binoculars electronic tag house arrest neighbor watching someone,english
iain softley,angelina jolie pitt,fisher stevens,lorraine bracco,comedy crime drama thriller,hackers,computer computer virus cyberpunk fight the system sexual fantasy,english
richard shepard,james brolin,zan marolt,ljubomir kerekes,adventure comedy drama romance thriller war,the hunting party,bosnia cia fox hunt war criminal,english
joel coen,jennifer jason leigh,bill cobbs,john mahoney,comedy fantasy,the hudsucker proxy,art deco board of directors industry mail stock,english
peter ho-sun chan,jet li,takeshi kaneshiro,andy lau,action drama history romance war,the warlords,assassination blood brother dynasty general stabbing a woman,mandarin
sergey bodrov,jay hernandez,kuno becker,jason scott lee,drama history war,nomad: the warrior,1800s kazakhstan nomad,kazakh
joon-ho bong,chris evans,ewen bremner,kang-ho song,action drama sci-fi thriller,snowpiercer,closed ecological system perpetual winter population control revolt train,english
bibo bergeron,adam goldberg,bob balaban,françois cluzet,adventure animation comedy fantasy music romance,a monster in paris,belle epoque city name in title monster paris france,french
jeff nathanson,matthew broderick,glenn morshower,tim blake nelson,comedy,the last shot,fbi movie producer sting operation undercover urination,english
alex proyas,michael wincott,bai ling,david patrick kelly,action drama fantasy,the crow,back from the dead crime boss crow gothic vigilante,english
s.s. rajamouli,tamannaah bhatia,anushka shetty,prabhas,action adventure drama fantasy war,baahubali: the beginning,ancient india dual role good versus evil hindu kingdom,telugu
robert schwentke,arliss howard,brooklynn proulx,michelle nolden,drama fantasy romance sci-fi,the time traveler's wife,jumping on a bed kissing while having sex librarian male objectification pregnant woman in bathtub,english
michael lehmann,colin ferguson,stephen collins,tom everett scott,comedy romance,because i said so,meddling psychologist sobbing female subtitled scene you can say that again joke,english
rob cohen,paul walker,vin diesel,jordana brewster,action crime thriller,the fast and the furious,eighteen wheeler illegal street racing truck trucker undercover cop,english
tim burton,martin landau,catherine o'hara,atticus shaffer,animation comedy family horror sci-fi,frankenweenie,dog life remake by original director science stop motion animation,english
joss whedon,adam baldwin,sean maher,michael hitchcock,action adventure sci-fi thriller,serenity,alliance cannibalism future operative planet,english
charles s. dutton,omar epps,charles s. dutton,tim daly,biography drama romance sport,against the ropes,boxer boxing boxing arena boxing manager directed by co star,english
richard lester,margot kidder,robert vaughn,jackie cooper,action comedy sci-fi,superman iii,computer high school kryptonite smallville villain,english
peter segal,robert de niro,sylvester stallone,oscar gale,comedy sport,grudge match,broke promoter retirement trainer training,english
john woo,takeshi kaneshiro,tony chiu wai leung,wei zhao,action adventure drama history war,red cliff,alliance battle china chinese strategy,mandarin
andy tennant,ethan embry,mary lynn rajskub,courtney gains,comedy romance,sweet home alabama,alabama divorce divorce papers husband wife relationship new york city,english
robert luketic,gerard butler,john michael higgins,eric winter,comedy romance,the ugly truth,call in chick flick date hot air balloon show producer,english
jonathan lynn,austin pendleton,phil hartman,max casella,comedy,sgt. bilko,greenland military revenge soldier u.s. soldier,english
robert rodriguez,steve buscemi,alexa penavega,emily osment,action adventure comedy family sci-fi,spy kids 2: island of lost dreams,island mad scientist scientist sequel spy,english
david carson,levar burton,alan ruck,jonathan frakes,action adventure mystery sci-fi thriller,star trek: generations,23rd century bare chested male bondage enterprise the starship rescue sacrifice,english
kar-wai wong,tony chiu wai leung,hye-kyo song,elvis tsui,action biography drama,the grandmaster,challenge china hong kong martial arts martial arts master,mandarin
francis lawrence,robert pattinson,christoph waltz,james frain,drama romance,water for elephants,circus circus vargas elephant fear train,english
unknown_director,joseph gordon-levitt,wayne knight,kristen johnston,comedy family sci-fi,3rd rock from the sun            ,alien digit in title human form number 3 in title talking on a rooftop,english
yuefeng song,blythe auffarth,bianca collins,jiao xu,adventure animation family fantasy,dragon nest: warriors' dawn,unknown_keywords,english
norman jewison,denzel washington,vincent pastore,deborah kara unger,biography drama sport,the hurricane,african american book boxer boxing murder,english
michael apted,bill cobbs,jeff kober,billy campbell,crime drama thriller,enough,abusive husband escape intimate partner homicide marriage woman wearing only a man's shirt,english
david mirkin,sarah silverman,anne bancroft,jeffrey jones,comedy crime romance,heartbreakers,bank infidelity millionaire money scam,english
andy fickman,d.b. woodside,daniella alonso,eduardo verástegui,action comedy crime,paul blart: mall cop 2,character name in title no opening credits sequel wilhelm scream,english
luis mandoki,sonia braga,shirley knight,kari matchett,drama romance,angel eyes,apartment fate gun love mysterious man,english
john pasquin,jim belushi,ken marino,kelly lynch,comedy drama,joe somebody,bully co worker divorce fight karate,english
roman polanski,johnny depp,frank langella,lena olin,mystery thriller,the ninth gate,bare butt gnosticism lucifer rare book sex,english
michael apted,j.k. simmons,paul guilfoyle,bill nunn,crime drama mystery thriller,extreme measures,cartoon on tv doctor emergency room hospital nudity,english
stephen herek,beth grant,dagmara dominczyk,matthew glave,drama music,rock star,cover band fired from a job heavy metal rock star tribute band,english
lee daniels,mo'nique,gabourey sidibe,mariah carey,drama,precious,abuse african american lesbian lesbian lesbian couple school,english
ridley scott,jeff bridges,jason marsden,ethan embry,adventure drama,white squall,acrophobia jamaica male bonding prostitute tragedy,english
john carpenter,wilford brimley,richard masur,david clennon,horror mystery sci-fi,the thing,alien creature alien life form antarctica isolation paranoia,english
david twohy,vin diesel,nolan gerard funk,bokeem woodbine,action sci-fi thriller,riddick,alien left for dead mercenary survival vomiting,english
jeb stuart,gregory scott cummins,claudia stedelin,ted markland,crime mystery thriller,switchback,deputy fbi agent knife held to throat serial killer sheriff,english
steve miner,tom skerritt,usher raymond,leonor varela,action adventure drama thriller western,texas rangers,army mexican orphan texas texas ranger,english
gil kenan,bill murray,toby jones,harry treadaway,adventure family fantasy sci-fi,city of ember,box food mayor pipeworks scientist,english
paul thomas anderson,mike howard,jeffrey w. jenkins,bruce goodchild,drama,the master,drifter past life regression psychological testing right hand man scientology,english
david leland,hayden christensen,ryan cartwright,david walliams,adventure comedy history romance,virgin territory,breasts nude nun plague russian nobleman two word title,english
gary fleder,dennis quaid,nicole beharie,charles s. dutton,biography drama sport,the express,african american coach football movie nonlinear timeline syracuse university,english
j blakeson,chloë grace moretz,maggie siff,nick robinson,action adventure sci-fi thriller,the 5th wave,alien attack based on novel based on young adult novel fear,english
ryan coogler,sylvester stallone,phylicia rashad,graham mctavish,drama sport,creed,boxing boxing match fight montage philadelphia,english
ben affleck,jeremy renner,jon hamm,owen burke,crime drama thriller,the town,bank manager bank robbery criminal gang heist prison,english
kirk jones,anna kendrick,dennis quaid,thomas lennon,comedy drama romance,what to expect when you're expecting,baby expecting twins hawaiian shirt photographer pregnancy,english
ethan coen,j.k. simmons,brad pitt,kevin sussman,comedy drama,burn after reading,cia divorce embassy gym memoir,english
jennifer flackett,gerard butler,anthony simcoe,christopher james baker,adventure comedy family fantasy,nim's island,author girl island reading scientist,english
ron howard,chris hemsworth,olivia wilde,alexandra maria lara,action biography drama sport,rush,1970s female rear nudity formula 1 rivalry sex with a nurse,english
paul thomas anderson,patton oswalt,neil flynn,jim meskimen,drama,magnolia,abusive father coincidence fictional game show fictional quiz show multiple storyline,english
kevin smith,bruce willis,tracy morgan,kevin pollak,action comedy crime,cop out,baseball card detective partner thief wedding,english
christian ditter,alison brie,damon wayans jr.,nicholas braun,comedy romance,how to be single,motor scooter new york city newborn baby scooter single,english
charles martin smith,morgan freeman,michael roark,harry connick jr.,drama family,dolphin tale,boy dolphin prosthetics tail trap,english
catherine hardwicke,kristen stewart,taylor lautner,anna kendrick,drama fantasy romance,twilight,blood high school love school vampire,english
nick cassavetes,denzel washington,laura harring,anne heche,crime drama thriller,john q,health care heart transplant hospital hostage insurance,english
les mayfield,peter greene,dave chappelle,tamala jones,action comedy crime thriller,blue streak,detective diamond jewel police thief,english
rawson marshall thurber,laura-leigh,molly c. quinn,thomas lennon,comedy crime,we're the millers,fake family male frontal nudity marijuana mexico stripper,english
fedor bondarchuk,yuliya snigir,fedor bondarchuk,aleksey serebryakov,action adventure sci-fi,obitaemyy ostrov,22nd century first part friend guard space opera,russian
jonathan mostow,kathleen quinlan,m.c. gainey,j.t. walsh,action crime drama mystery thriller,breakdown,car breakdown diner jeep paranoia violence,english
irvin kershner,bernie casey,klaus maria brandauer,barbara carrera,action adventure thriller,never say never again,british character says now that you're on the case i hope we're going to have some gratuitous sex and violence cruise missile missile nuclear warhead,english
steve pink,charlie mcdermott,collette wolfe,crystal lowe,comedy sci-fi,hot tub time machine,cheating wife drug reference maintenance man male vomiting promiscuous woman,english
charles martin smith,morgan freeman,taylor blackwell,harry connick jr.,drama family,dolphin tale 2,dolphin latex gloves medical scrubs purple gloves turtle,english
john frankenheimer,charlize theron,james frain,clarence williams iii,action adventure crime drama family fantasy romance thriller,reindeer games,casino christmas christmas season girlfriend release from prison,english
f. gary gray,vin diesel,jeff kober,larenz tate,action crime drama thriller,a man apart,bust dea drug cartel justice tragic hero,english
cameron crowe,emma stone,bradley cooper,bill murray,comedy drama romance,aloha,box office flop critically bashed hawaii one word title written by director,english
rob reiner,alexa penavega,virginia madsen,craig t. nelson,drama history,ghosts of mississippi,activist assassin civil rights trial widow,english
scott hicks,rick yune,reeve carney,daniel von bargen,drama mystery romance thriller,snow falling on cedars,fisherman japanese love trial washington state,english
mikael håfström,anthony hopkins,colin o'donoghue,toby jones,drama horror mystery thriller,the rite,demon exorcism exorcist faith seminary,english
andrew niccol,blair underwood,xander berkeley,mason gamble,drama sci-fi thriller,gattaca,accident future genetics mission police,english
andrew bergman,stockard channing,nathan lane,john larroquette,biography comedy romance,isn't she great,autistic son cancer female protagonist new york city son,english
kirk de micco,cheryl hines,kenan thompson,omid abtahi,adventure animation comedy family sci-fi,space chimps,astronaut attacked by a plant planet senator space travel,english
chris rock,bernie mac,dylan baker,tracy morgan,comedy,head of state,alderman party president presidential candidate washington d.c.,english
todd phillips,bradley cooper,rob riggle,mike epps,comedy,the hangover,drunkenness female nudity hangover hedonism morning after,english
wilson yip,mike tyson,lynn hung,kwok-kwan chan,action biography drama history,ip man 3,1950s cancer hong kong martial arts school wing chun,cantonese
jay roach,muse watson,verne troyer,robert wagner,action adventure comedy crime,austin powers: the spy who shagged me,penis joke phallic image sexy agent spy volcano hideout,english
tim burton,michael gough,jack palance,william hootkins,action adventure,batman,city dc comics gotham pantyhose police,english
roland joffé,jordi mollà,dougray scott,lily cole,biography drama war,there be dragons,dying forgiveness saint spanish civil war starts with narration,english
richard donner,rene russo,nick chinlund,stuart wilson,action crime thriller,lethal weapon 3,gangster gun internal affairs police police officer,english
john lee hancock,catherine dyer,quinton aaron,kim dickens,biography drama sport,the blind side,american football based on true story football star high school football left tackle,english
unknown_director,jon foo,aimee garcia,wendie malick,action comedy crime,rush hour            ,unknown_keywords,english
robert rodriguez,alexa penavega,cheech marin,daryl sabara,action adventure comedy family sci-fi,spy kids,brother sister relationship espionage rescue secret agent spy,english
seth gordon,kevin spacey,lindsay sloane,reginald ballard,comedy crime,horrible bosses,black comedy boss chemical company dental assistant murder,english
ethan coen,matt damon,jeff bridges,bruce green,adventure drama western,true grit,arkansas murder sheriff texas ranger u.s. marshal,english
david frankel,meryl streep,anne hathaway,rebecca mader,comedy drama romance,the devil wears prada,fashion fashion industry magazine new york city publishing,english
robert wise,leonard nimoy,nichelle nichols,walter koenig,adventure mystery sci-fi,star trek: the motion picture,alien space space station spacecraft warp speed,english
seth gordon,jon favreau,eric stonestreet,t.i.,comedy crime,identity thief,bounty hunter credit card cross country identity police,english
martin scorsese,robert de niro,robert mitchum,joe don baker,crime thriller,cape fear,lawyer neo noir prison rapist southern gothic,english
robert luketic,kevin spacey,jim sturgess,josh gad,crime drama thriller,21,based on true story blackjack card counting gambling massachusetts institute of technology,english
judd apatow,amy schumer,randall park,josh segarra,comedy romance,trainwreck,actress playing herself actress shares first name with character fired from a job male nudity written by star,english
kevin rodney sullivan,bernie mac,nicole sullivan,sherri shepherd,comedy romance,guess who,argument engagement family relationships love undressing,english
anthony minghella,colin firth,kristin scott thomas,jürgen prochnow,drama romance war,the english patient,church english flashback nurse patient,english
curtis hanson,kevin spacey,matt mccoy,paul guilfoyle,crime drama mystery thriller,l.a. confidential,1950s call girl corruption murder police detective,english
mike mitchell,michael angarano,kelly preston,nicholas braun,adventure comedy family sci-fi,sky high,coming of age friend high school sidekick superpower,english
frank oz,tom selleck,wilford brimley,lauren ambrose,comedy,in & out,academy award gay high school reporter teacher,english
roger donaldson,natasha henstridge,marg helgenberger,jordan lund,action horror sci-fi thriller,species,alien interspecies sex scientist sexual attraction train,english
wes craven,johnny depp,lin shaye,amanda wyss,horror,a nightmare on elm street,freddy krueger lucid dream serial killer slasher sleep deprivation,english
tarsem singh,dylan baker,jake weber,james gammon,horror sci-fi thriller,the cell,coma fbi race against time serial killer strong female lead,english
randall wallace,leonardo dicaprio,anne parillaud,judith godrèche,action adventure,the man in the iron mask,france musketeer three musketeers twin twin brother,english
randall wallace,scott glenn,kevin connolly,dylan walsh,biography drama family history sport,secretariat,eccentric horse racing newspaper clipping stallion triple crown,english
kevin munroe,chris evans,sarah michelle gellar,mako,action adventure animation comedy family fantasy sci-fi,tmnt,martial arts master monster new york city turtle warrior,english
michael tollin,alfre woodard,riley smith,debra winger,biography drama sport,radio,coach football football coach high school radio,english
will gluck,mila kunis,justin timberlake,masi oka,comedy romance,friends with benefits,blow job female rear nudity girl in panties male objectification no panties,english
nicholas stoller,chloë grace moretz,ike barinholtz,kiersey clemons,comedy,neighbors 2: sorority rising,bare chested male gay gay best friend gay man gay marriage proposal,english
john lee hancock,tom hanks,ruth wilson,b.j. novak,biography comedy drama history music,saving mr. banks,author disney loss of father reference to walt disney suppression of emotion,english
spike lee,denzel washington,delroy lindo,al freeman jr.,biography drama history romance,malcolm x,african american black history civil rights ku klux klan nation of islam,english
judd apatow,charlyne yi,maude apatow,mackenzie aladjem,comedy,this is 40,40th birthday aging birthday sex viagra,english
walt becker,robin williams,bernie mac,ann-margret,comedy family,old dogs,best friend business deal impulse public relations twin,english
patrick tatopoulos,craig parker,kevin grevioux,steven mackintosh,action adventure fantasy sci-fi thriller,underworld: rise of the lycans,battle slave vampire warrior werewolf,english
ken kwapis,robin williams,christine taylor,mindy kaling,comedy romance,license to wed,box office flop church kissing usa wedding,english
dennis dugan,jon lovitz,jon heder,tim meadows,comedy romance sport,the benchwarmers,baseball baseball team bully millionaire team,english
gary david goldberg,stockard channing,victor webster,elizabeth perkins,comedy romance,must love dogs,date dating dog love teacher,english
mike newell,johnny depp,al pacino,anne heche,biography crime drama,donnie brasco,fbi mafia money racial slur singer,english
paul w.s. anderson,milla jovovich,jaymes butler,colin salmon,action horror sci-fi,resident evil,amnesia quarantine special forces virus zombie,english
tobe hooper,heather o'rourke,zelda rubinstein,craig t. nelson,fantasy horror,poltergeist,ghost haunted haunting house paranormal investigator,english
ethan coen,j.k. simmons,tom hanks,stephen root,comedy crime thriller,the ladykillers,casino irony of fate landlady professor remake,english
john moore,mila kunis,beau bridges,jamie hector,action crime drama mystery thriller,max payne,corporation death ex partner hallucination police detective,english
andrew niccol,matt bomer,olivia wilde,justin timberlake,action sci-fi thriller,in time,currency future murder on the run time,english
alan poul,danneel ackles,noureen dewulf,tom bosley,comedy romance,the back-up plan,artificial insemination baby cheese chick flick pet shop,english
luke greenfield,ashley williams,steve howey,kirsten day,comedy drama romance,something borrowed,best friend crush law school lawyer loud sex,english
unknown_director,jodi lyn o'keefe,kimberly elise,logan browning,drama romance,hit the floor            ,affair hip hop sex scene,english
gil junger,tom wilkinson,marsha thomason,vincent regan,adventure comedy fantasy,black knight,14th century king knight sword duel time travel,english
michael ritchie,tatum o'neal,vic morrow,joyce van patten,comedy drama family sport,the bad news bears,baseball california coach little league swimming pool,english
steven e. de souza,ming-na wen,raul julia,kylie minogue,action adventure comedy thriller,street fighter,guile hostage ransom soldier united nations,english
roman polanski,emilia fox,frank finlay,ed stoppard,biography drama war,the pianist,ghetto holocaust jewish piano warsaw ghetto,english
albert hughes,johnny depp,jason flemyng,ian richardson,horror mystery thriller,from hell,freemason jack the ripper opium prostitute victorian era,english
catherine hardwicke,keisha castle-hughes,hiam abbass,shaun toub,drama family fantasy,the nativity story,angel bethlehem journey nazareth virgin,english
jaume collet-serra,robert ri'chard,paris hilton,brian van holt,horror,house of wax,brother sister relationship group of friends male nudity twin wax,english
