director_name,actor_1_name,actor_2_name,actor_3_name,genres,movie_title,plot_keywords,language
john boorman,daniel radcliffe,jamie lee curtis,mark margolis,drama thriller,the tailor of panama,canal panama president spy tailor,english
brian de palma,nancy allen,dennis franz,john mcmartin,mystery thriller,blow out,conspiracy political conspiracy recording sound truth,english
courtney solomon,rebecca budig,paul freeman,bruce payne,action crime thriller,getaway,die hard scenario earth viewed from space race against time race car driver title at the end,english
ang lee,joan allen,kate burton,henry czerny,drama,the ice storm,ice ice storm storm thanksgiving virgin,english
rob reiner,yaya dacosta,annie parisse,frankie valli,comedy drama romance,and so it goes,four word title grandparent grandchild relationship reference to facebook reference to the internet singer,english
jeff kanew,craig t. nelson,shelley long,kellie martin,adventure comedy,troop beverly hills,beverly hills hotel divorce girl troop wilderness,english
istván szabó,miriam margolyes,shaun evans,juliet stevenson,comedy drama romance,being julia,diva marriage open marriage revenge social climber,english
adrian lyne,david margulies,karen young,kim chan,drama romance,9½ weeks,blindfolded woman control male dominance sex game sex in public,english
matthew robbins,ian mcdiarmid,ralph richardson,albert salmi,action adventure fantasy,dragonslayer,apprentice dragon king kingdom wizard,english
michael hoffman,david masterson,kerry condon,anne-marie duff,biography drama romance,the last station,countess leo tolstoy russian wealth writing,english
tim burton,johnny depp,bill murray,martin landau,biography comedy drama,ed wood,1950s director friend friendship transvestism,english
jason reitman,j.k. simmons,kate winslet,brooke smith,drama,labor day,baseball baseball practice escaped convict neighbor tied to a chair,english
sergey bodrov,tadanobu asano,khulan chuluun,honglei sun,adventure biography drama history war,mongol: the rise of genghis khan,epic genghis khan one word title slave starving,mongolian
guy ritchie,tom hardy,gerard butler,tom wilkinson,action crime thriller,rocknrolla,accountant finger gun homosexual killed in an elevator painting,english
hal needham,barry bostwick,michael beck,henry silva,action sci-fi,megaforce,dictator electronic music score one word title secret headquarters soldier,english
kenneth branagh,julie christie,brian blessed,richard briers,drama,hamlet,classic literature denmark funeral madness prince,english
bruce beresford,bruce greenwood,suzie steen,aden young,biography drama music romance,mao's last dancer,ballet beijing dancer love village,english
jeff nichols,kirsten dunst,sam shepard,paul sparks,adventure drama sci-fi thriller,midnight special,cult father son relationship gas station on the run supernatural ability,english
woody allen,woody allen,stockard channing,fisher stevens,comedy romance,anything else,love at first sight new york city sex teacher writer,english
jonathan teplitzky,jeremy irvine,colin firth,sam reid,biography drama romance war,the railway man,japanese soldier physical torture pow camp prisoner of war reference to adolf hitler,english
unknown_director,poppy montgomery,dylan walsh,dallas roberts,drama mystery,unforgettable            ,hyperthymesia new york city police,english
michael haneke,ulrich tukur,burghart klaußner,leonie benesch,drama mystery,the white ribbon,children doctor mysterious event pastor small village,german
zack ward,zack ward,anna harr,james cullen bressack,horror,restoration,unknown_keywords,english
mike marvin,clint howard,randy quaid,nick cassavetes,action horror romance sci-fi thriller,the wraith,arizona death gang police sheriff,english
d.j. caruso,adam goldberg,meat loaf,anthony lapaglia,crime drama mystery thriller,the salton sea,male in shower murder neighbor neighbor relationship remote control car sex scene,english
nimród antal,james hetfield,mackenzie gray,lars ulrich,music,metallica through the never,headbanger metallica roadie song in title standing on the roof of a car,english
gregor jordan,austin nichols,brad renfro,lou taylor pucci,crime drama thriller,the informers,breasts female nudity male pubic hair pubic hair sex scene,english
unknown_director,edgar ramírez,nora von waldstätten,katharina schüttler,biography crime drama thriller,carlos            ,opec pubic hair revolutionary terrorism true crime,english
tran anh hung,takuya kimura,simón andreu,shawn yue,thriller,i come with the rain,gangster hong kong missing person missing son serial killer,english
lance hool,tom berenger,joaquim de almeida,mark moses,action drama history romance war western,one man's hero,american battalion catholic mexican sergeant,english
george a. romero,greg nicotero,john amplas,joseph pilato,horror,day of the dead,bunker experiment military research scientist,english
chuck russell,sam trammell,rebecca de mornay,amanda schull,action crime drama thriller,i am wrath,conspiracy female scientist mugging police detective tattoo,english
christian volckman,romola garai,catherine mccormack,kevork malikyan,action animation sci-fi thriller,renaissance,future kidnapping missing file paris france year 2054,english
jon cassar,demi moore,landon liboiron,michael wincott,drama western,forsaken,unknown_keywords,english
richard fleischer,ernie reyes jr.,brigitte nielsen,sandahl bergman,action adventure fantasy,red sonja,cult film psychotronic sword and sorcery talisman warrior,english
rodrigo cortés,robert de niro,toby jones,craig roberts,drama horror mystery thriller,red lights,fraud physicist psychic skeptic tailing,english
greg mottola,emma stone,joe lo truglio,kevin corrigan,comedy,superbad,black comedy bromance party school teen comedy,english
tyler perry,vanessa ferlito,keshia knight pulliam,derek luke,comedy crime drama,madea goes to jail,adaptation directed by original author cross dressing madea series remake sequel,english
david hayter,jason momoa,jennifer hale,stephen mchattie,action horror,wolves,bar female nudity murder small town werewolf,english
jon m. chu,cassie ventura,mari koda,luis rosado,drama music musical romance,step up 2: the streets,audition dance kissing in the rain student subway,english
cory edwards,anne hathaway,chazz palminteri,jim belushi,action animation comedy crime family,hoodwinked!,animal axe red riding hood wolf woodsman,english
terry george,don cheadle,sophie okonedo,hakeem kae-kazim,drama history war,hotel rwanda,atrocity central africa ethnic warfare united nations peace keeping force united nations soldier,english
xavier gens,henry ian cusick,dougray scott,ulrich thomsen,action crime drama thriller,hitman,hitman impersonation see through dress topless female nudity woman on top,english
kasi lemmons,jennifer hudson,mary j. blige,vondie curtis-hall,drama family music musical,black nativity,based on stage musical based on the bible christmas color in title nativity,english
brian a miller,bruce willis,50 cent,jessica lowndes,action thriller,the prince,assassin fight mechanic rescue rival,english
matt dillon,kirk fox,shawn andrews,rob campbell,crime drama thriller,city of ghosts,bag over head buddhist temple loss of friend male bonding nightclub,english
alejandro amenábar,fionnula flanagan,elaine cassidy,eric sykes,fantasy horror thriller,the others,curtain haunting mansion mute xeroderma pigmentosum,english
james cameron,michael biehn,carrie henn,jenette goldstein,action adventure sci-fi,aliens,alien human versus alien monster rescue mission space marine,english
george cukor,jeremy brett,rex harrison,theodore bikel,drama family musical romance,my fair lady,colonel flower girl professor street wager,english
jim gillespie,muse watson,sarah michelle gellar,anne heche,horror mystery thriller,i know what you did last summer,beach corpse fourth of july overalls revenge,english
luke greenfield,rob riggle,damon wayans jr.,james d'arcy,comedy,let's be cops,friendship between men impersonating a police officer mobster party police officer,english
alexander payne,virginia madsen,patrick gallagher,m.c. gainey,adventure comedy drama romance,sideways,actor california teacher wine writer,english
jay chandrasekhar,chris moss,owain yeoman,jay chandrasekhar,comedy,beerfest,beer competition germany oktoberfest prostitute,english
john carpenter,jamie lee curtis,donald pleasence,p.j. soles,horror thriller,halloween,halloween masked killer michael myers slasher trick or treat,english
yimou zhang,jet li,tony chiu wai leung,maggie cheung,action adventure history,hero,china flying king palace sword,mandarin
john hoffman,liam aiken,molly shannon,kevin nealon,comedy drama family fantasy sci-fi,good boy!,dog friend neighborhood planet star,english
malcolm d. lee,harold perrineau,sanaa lathan,eddie cibrian,comedy drama,the best man holiday,childbirth christmas gay slur infidelity punched in the nose,english
joe carnahan,ryan reynolds,common,alex rocco,action crime drama thriller,smokin' aces,casino fbi mafia mob hit sniper,english
kevin greutert,costas mandylor,gina holden,betsy russell,horror mystery,saw 3d: the final chapter,blood splatter self help guru sequel support group survivor,english
michael lehmann,emmanuelle vaugier,vinessa shaw,paulo costanzo,comedy romance,40 days and 40 nights,female on male rape lent male rear nudity masturbation sex,english
joseph kosinski,jeff bridges,olivia wilde,james frain,action adventure sci-fi,tron: legacy,arcade bridge disappearance escape warrior,english
john fortenberry,will ferrell,chris kattan,dan hedaya,comedy music romance,a night at the roxbury,1990s bar car accident nightclub whipped cream,english
daniel barnz,alex pettyfer,mary-kate olsen,erik knudsen,drama fantasy romance,beastly,love maid newscaster student tutor,english
alexandre aja,dan byrd,greg nicotero,vinessa shaw,horror,the hills have eyes,desert horror movie remake murder of family rape slasher,english
sam weisman,kevin grevioux,jenna boyd,mary mccormack,comedy,dickie roberts: former child star,dental braces dental headgear former child star panties white panties,english
niki caro,morgan saylor,valente rodriguez,diana maria riva,biography drama sport,"mcfarland, usa",coach high school place name in title school student,english
erik white,brandon t. jackson,loretta devine,shad moss,comedy,lottery ticket,block party eurocopter ec120 colibri fortune cookie lottery ticket reverend,english
chris robinson,t.i.,adam boyer,malika,comedy crime drama music romance,atl,high school rollerskating rink spelman college twin voice over narration,english
jason moore,anna kendrick,hana mae lee,ben platt,comedy music romance,pitch perfect,a cappella competition dj female protagonist lesbian,english
michael tollin,marc blucas,brian dennehy,bruce davison,comedy drama romance sport,summer catch,baseball baseball player night rivalry summer,english
sam raimi,gary cole,bridget fonda,chelcie ross,crime drama thriller,a simple plan,bag of money found money minnesota screenplay adapted by author snow,english
robert harmon,alexander gould,ethan embry,marc blucas,horror mystery thriller,they,darkness friend kiss nightmare suicide,english
trent cooper,thomas f. wilson,larry the cable guy,megyn price,comedy romance,larry the cable guy: health inspector,diner food poisoning health inspector restaurant undercover,english
gary halvorson,vanessa williams,kevin clash,caroll spinney,adventure comedy family fantasy musical,the adventures of elmo in grouchland,based on tv series blanket box office flop rescue sesame street,english
antoine fuqua,don cheadle,lili taylor,armando riesco,crime drama thriller,brooklyn's finest,catholic corrupt cop new york city police detective police officer killed,english
nicholas ray,ava gardner,david niven,john ireland,action adventure drama history war,55 days at peking,ambassador boxer rebellion china colonialism peking china,english
fede alvarez,lou taylor pucci,elizabeth blackmore,ellen sandweiss,horror,evil dead,book of the dead demon h.p. lovecraft lesbian kiss promise,english
donald petrie,nia vardalos,harland williams,rachel dratch,comedy romance,my life in ruins,greece greek tour bus tour guide tourist,english
paul weitz,judy greer,dennis quaid,chris klein,comedy music,american dreamz,chief of staff contest president singing terrorist,english
sidney j. furie,jim broadbent,margot kidder,william hootkins,action adventure family sci-fi,superman iv: the quest for peace,box office flop dc comics hair nuclear disarmament superman,english
ian iqbal rashid,deray davis,clé bennett,conrad coates,drama,how she move,dance dance contest loss of sister step dancing teenager,english
wayne kramer,paul walker,chazz palminteri,ivana milicevic,action crime drama thriller,running scared,adult child friendship corrupt cop fistfight gangster thug,english
rowdy herrington,aidan quinn,jeremy northam,paul freeman,biography drama romance sport,bobby jones: stroke of genius,colon in title competition five word title golf temper,english
jim goddard,victor wong,paul freeman,clyde kusatsu,adventure crime drama romance,shanghai surprise,china missionary opium villain year 1937,english
neil burger,rufus sewell,eddie marsan,jake wood,drama mystery romance thriller,the illusionist,duchess illusionist magician prince supernatural power,english
noel marshall,tippi hedren,melanie griffith,zakes mokae,adventure horror thriller,roar,chase dead man jungle killing a lion killing a tiger,english
joel schumacher,brenda fricker,david murray,gerard mcsorley,biography crime drama thriller,veronica guerin,criminal drug lord gunshot irish journalist,english
andrea di stefano,josh hutcherson,brady corbet,carlos bardem,crime drama romance thriller,escobar: paradise lost,colombia dream love surfer village,english
richard kelly,janeane garofalo,curtis armstrong,chris andrew ciulla,comedy mystery sci-fi thriller,southland tales,amnesia boxer conspiracy police porn star,english
guillaume ivernel,rob paulsen,jess harnell,mary mouser,adventure animation family fantasy,dragon hunters,cgi film computer animation dragon hunter,french
jack smight,george peppard,jan-michael vincent,paul winfield,sci-fi,damnation alley,cockroach desert ghost town giant spider travel,english
todd lincoln,julianna guill,rick gomez,tim williams,horror thriller,the apparition,e mail evil spirit experiment fear supernatural,english
howard zieff,macaulay culkin,jamie lee curtis,griffin dunne,comedy drama family romance,my girl,best friend funeral girl overalls summer,english
steven shainberg,robert downey jr.,ty burrell,matt servitto,biography drama romance,fur: an imaginary portrait of diane arbus,character name in title diane arbus male full frontal nudity photographer pubic hair,english
neil burger,rufus sewell,eddie marsan,jake wood,drama mystery romance thriller,the illusionist,duchess illusionist magician prince supernatural power,english
oliver stone,hal holbrook,tamara tunie,james karen,crime drama,wall street,1980s argument critique of capitalism f word fired from the job,english
ang lee,alan rickman,kate winslet,tom wilkinson,drama romance,sense and sensibility,1810s female protagonist horseback riding inheritance three word title,english
julian jarrold,anne hathaway,julie walters,laurence fox,biography drama romance,becoming jane,country estate jane austen lady love writing,english
joe nussbaum,danny strong,matt long,samm levine,comedy romance,sydney white,college college girl female protagonist sorority sorority house,english
vadim perelman,frances fisher,kim dickens,ron eldard,drama,house of sand and fog,auction home house iranian marriage,english
peter weir,robin williams,josh charles,kurtwood smith,comedy drama,dead poets society,education english teacher poet professor student,english
peter farrelly,lauren holly,mike starr,teri garr,comedy,dumb & dumber,briefcase full of money character repeating someone else's dialogue character says i love you friendship reference to cinderella,english
rob reiner,bruno kirby,gretchen palmer,harley jane kozak,comedy drama romance,when harry met sally...,friendship love male female friendship new york sex,english
sidney lumet,charlotte rampling,james mason,jack warden,drama,the verdict,archdiocese court hospital lawyer malpractice,english
todd phillips,ethan suplee,rachel blanchard,paulo costanzo,comedy,road trip,blonde college friend highway travel road trip,english
brian robbins,paul walker,ron lester,mark walters,comedy drama romance sport,varsity blues,coach coyote popularity quarterback texas,english
michel hazanavicius,bérénice bejo,ed lauter,beth grant,comedy drama romance,the artist,1920s jack russell terrier modern silent movie movie star movie studio,english
david s. goyer,gary oldman,atticus shaffer,rachel brosnahan,drama fantasy horror mystery thriller,the unborn,babysitting experiment nightmare possession twin,english
wes anderson,bruce willis,bill murray,bob balaban,adventure comedy drama romance,moonrise kingdom,1960s boy scouts boy scouts camp coming of age young love,english
jonathan liebesman,matt bomer,jordana brewster,lew temple,horror,the texas chainsaw massacre: the beginning,cannibal car accident leatherface psychopath slaughterhouse,english
cyrus nowrasteh,clive russell,vincent walsh,finn ireland,drama,the young messiah,based on novel,english
perry andelin blake,jennifer esposito,kenan thompson,james brolin,comedy family,the master of disguise,disguise mask master of disguise restaurant waiter,english
guillermo del toro,ivana baquero,maribel verdú,sergi lópez,drama fantasy war,pan's labyrinth,fairy fairy tale faun princess spain,spanish
unknown_director,joel courtney,jessika van,riley smith,drama fantasy mystery thriller,the messengers            ,unknown_keywords,english
john whitesell,leslie bibb,angus t. jones,paul sorvino,action comedy crime family,see spot run,boy fbi mailman van witness protection,english
john singleton,mo'nique,snoop dogg,angell conwell,crime drama romance thriller,baby boy,cartoon on tv family relationships physical abuse single parent two word title,english
christian e. christiansen,leighton meester,danneel ackles,frances fisher,drama horror thriller,the roommate,animal abuse(non graphic) cat killer college dead cat death of cat,english
dennie gordon,brittany daniel,erik per sullivan,fred ward,adventure comedy drama,joe dirt,first part grand canyon highway travel indian janitor,english
sheldon lettich,bolo yeung,alonna shaw,kamel krifa,action crime,double impact,boat hong kong murder tunnel twins,english
edgar wright,bill bailey,joe cornish,billie whitelaw,action comedy mystery,hot fuzz,accident conspiracy police police officer village,english
diane english,jada pinkett smith,debi mazar,debra messing,comedy drama,the women,beauty salon divorce fashion new york perfume,english
woody allen,scarlett johansson,kevin dunn,christopher evan welch,drama romance,vicky cristina barcelona,art artist painter sex summer,english
peter flinth,gustaf skarsgård,michael nyqvist,vincent perez,action adventure drama romance war,arn: the knight templar,first part holy land knight templar monastery sword and shield,swedish
jon lucas,mila kunis,jay hernandez,jada pinkett smith,comedy,bad moms,lesbian kiss mom pta reference to mad max scene during end credits,english
robert iscove,alyson hannigan,amanda detmer,tsianina joelson,comedy drama romance,boys and girls,best friend break up friendship graduation male in underwear,english
peter kosminsky,patrick fugit,cole hauser,marc donato,drama,white oleander,california foster home love oleander prison,english
karyn kusama,j.k. simmons,amy sedaris,cynthia stevenson,comedy fantasy horror,jennifer's body,cannibalism cheerleader condom hook for hand satanic ritual,english
nick gomez,will ferrell,jamie lee curtis,tracey walter,comedy crime mystery,drowning mona,crying woman plot suspect waitress younger man older woman relationship,english
woody allen,mike starr,don pardo,julie kavner,comedy,radio days,beach cigarette girl radio woman holding a baby working class,english
vic armstrong,nicolas cage,lea thompson,quinton aaron,action drama fantasy mystery thriller,left behind,bible quote chaos faith riot shrine,english
allen coulter,robert pattinson,lena olin,ruby jerins,drama romance,remember me,binge drinking new york new york city september 11 2001 suicide,english
clare kilner,dylan baker,alexandra holden,trent ford,comedy drama romance,how to deal,best friend high school mother sister wedding,english
richard benjamin,jon lovitz,alyson hannigan,tony jay,comedy romance sci-fi,my stepmother is an alien,alien earth female alien mission secret,english
jonathan demme,denzel washington,tom hanks,jason robards,drama,philadelphia,aids city name in title gay homophobia lawyer,english
josef rusnak,gretchen mol,craig bierko,brad william henke,mystery sci-fi thriller,the thirteenth floor,amnesia barricade letter time virtual reality,english
lance rivera,farrah fawcett,vincent pastore,jenifer lewis,comedy,the cookout,flatulence interracial marriage marriage,english
ronald neame,martin landau,karl malden,brian keith,action drama sci-fi thriller,meteor,asteroid meteor nasa nuclear weapon satellite,english
bruce paltrow,lochlyn munro,marian seldes,huey lewis,comedy drama music,duets,convict karaoke middle america salesman singer,english
woody allen,woody allen,debra messing,treat williams,comedy romance,hollywood ending,blind director psychosomatic blindness self deprecating studio,english
adam rifkin,natasha lyonne,lin shaye,shannon tweed,comedy music,detroit rock city,band concert high school kiss teenager,english
russell mulcahy,christopher lambert,jon polito,celia imrie,action adventure fantasy,highlander,combat head cut off immortal scotland swordsman,english
susanne bier,alison lohman,omar benson miller,robin weigert,drama,things we lost in the fire,best friend dinner garage narcotics anonymous recovery,english
kenneth johnson,charles napier,annabeth gish,hill harper,action crime sci-fi,steel,fight gang junkyard military soldier,english
james gray,jeremy renner,dagmara dominczyk,angela sarafyan,drama romance,the immigrant,immigrant immigration magician money prostitution,english
james ivory,vanessa redgrave,natasha richardson,lynn redgrave,drama history romance war,the white countess,countess diplomat japanese russian shanghai,english
danny boyle,rosario dawson,spencer wilding,tuppence middleton,crime drama mystery thriller,trance,amnesia criminal heist hypnotherapy lost painting,english
jessy terrero,mo'nique,snoop dogg,tom arnold,comedy,soul plane,airline airplane bathroom sex toilet,english
dany boon,dany boon,kad merad,michel galabru,comedy romance,welcome to the sticks,alcohol alcoholic drink drunken man france provence,french
vicente amorim,viggo mortensen,jodie whittaker,steven mackintosh,drama romance war,good,censorship children corpse heil hitler suffering,english
gaspar noé,paz de la huerta,emily alyn lind,olly alexander,drama fantasy,enter the void,drug deal drugs explicit sex love stripper,english
amy heckerling,taylor negron,justin kirk,ivan sergei,comedy horror romance,vamps,murder new york city one word title vampire vampire slayer,english
lasse hallström,cary-hiroyuki tagawa,sarah roemer,joan allen,drama family,hachi: a dog's tale,dog human animal relationship japanese loyalty waiting,english
jérôme salle,orlando bloom,tanya van graan,conrad kemp,crime drama thriller,zulu,apartheid corpse male nudity murder police officer,english
tommy lee jones,barry corbin,tim blake nelson,miranda otto,drama western,the homesman,abusive marriage pastor prison wagon roast pig suicide by hanging,english
jesse vaughan,vivica a. fox,jenifer lewis,kevin pollak,comedy drama romance sport,juwanna mann,basketball dodge viper hit in the crotch male nudity the star spangled banner,english
unknown_director,steven van zandt,trond fausa,tommy karlsen,comedy crime drama,lilyhammer            ,mafia mob norway steve van,english
atom egoyan,david alpay,marie-josée croze,charles aznavour,drama war,ararat,armenian armenian genocide customs agent genocide prayer,english
william bindley,bruce dern,jake lloyd,william shockley,drama sport,madison,boat racing hydroplane loyalty one word title scolding,english
wayne beach,mekhi phifer,ll cool j,fisher stevens,drama mystery thriller,slow burn,district attorney interview murder prosecutor reporter,english
gérard krawczyk,carole bouquet,ryôko hirosue,michel muller,action comedy crime drama thriller,wasabi,french inheritance japan letter police detective hero,french
james gunn,dustin milligan,gregg henry,tania saulnier,comedy horror sci-fi,slither,alien b movie sex slug small town,english
martin brest,judge reinhold,ronny cox,james russo,action comedy crime,beverly hills cop,drug dealer drugs murder police brutality police shootout,english
chris columbus,macaulay culkin,devin ratray,catherine o'hara,comedy family,home alone,airport child protagonist child swearing christmas home alone,english
leonard nimoy,tom selleck,ted danson,steve guttenberg,comedy drama family,3 men and a baby,1980s baby heroin package questioned by police,english
sydney pollack,bill murray,sydney pollack,teri garr,comedy drama romance,tootsie,actor actress friend love reputation,english
tony scott,tom cruise,tom skerritt,adrian pasdar,action drama romance,top gun,flying gay subtext machismo male objectification pilot,english
ang lee,chen chang,pei-pei cheng,sihung lung,action drama romance,"crouching tiger, hidden dragon",bare midriff china magical realism martial arts sword,mandarin
sam mendes,kevin spacey,peter gallagher,ara celi,drama,american beauty,domestic violence drug dealer homosexuality midlife crisis unfaithfulness,english
