director_name,actor_1_name,actor_2_name,actor_3_name,genres,movie_title,plot_keywords,language
peter howitt,jeanne tripplehorn,kevin mcnally,john lynch,comedy drama fantasy romance,sliding doors,alternative reality multiple outcomes parallel time serendipity twist of fate,english
rusty cundieff,corbin bernsen,clarence williams iii,david alan grier,comedy horror thriller,tales from the hood,child abuse death drugs ku klux klan police brutality,english
kevin macdonald,david oyelowo,simon mcburney,abby mukiibi nkaaga,biography drama history thriller,the last king of scotland,1970s assassination doctor scottish ugandan,english
dominique othenin-girard,donald pleasence,tamara glynn,troy evans,horror thriller,halloween 5,cat halloween kitten michael myers psychotronic,english
richard linklater,matthew mcconaughey,brandon smith,rick dial,comedy crime drama,bernie,funeral stockbroker texas vacation widow,english
jean-jacques mantello,charlotte rampling,daryl hannah,unknown_actor,adventure documentary short,dolphins and whales 3d: tribes of the ocean,3d in title animal in title digit in title dolphin manatee,english
ed harris,john heard,bud cort,amy madigan,biography drama,pollock,1940s artist drinking life magazine painter,english
risa bramon garcia,janeane garofalo,dave chappelle,gaby hoffmann,comedy drama romance,200 cigarettes,bartender friend new year's eve party punk,english
brian klugman,j.k. simmons,bradley cooper,olivia wilde,drama mystery romance thriller,the words,american in paris book love novel writer,english
matt piedmont,will ferrell,adrian martinez,luis e. carazo,comedy western,casa de mi padre,absurd humor drug lord mexico ranch spaghetti western,spanish
raymond de felitta,ezra miller,curtiss cook,dominik garcía-lorido,comedy drama,city island,anger family reunion father son reunion hugging movie making,english
john michael mcdonagh,don cheadle,fionnula flanagan,wale ojo,comedy crime thriller,the guard,boat on fire drug smuggling fbi fbi agent small town,english
deb hagan,drake bell,alona tal,haley bennett,comedy,college,college face slap high school loss of virginity pierced nipple,english
sofia coppola,kirsten dunst,kathleen turner,scott glenn,drama romance,the virgin suicides,catholic five sisters isolation school suicide,english
mark herman,jim broadbent,annette badland,brenda blethyn,comedy drama music romance,little voice,mother recluse shy singer talent,english
zach cregger,hugh m. hefner,windell middlebrooks,raquel alessi,comedy romance,miss march,fellatio hugh hefner oral sex playboy centerfold topless female nudity,english
zach braff,jim parsons,josh gad,michael weston,comedy drama,wish i was here,actor dream sequence genius recluse jew religion,english
mark tarlov,sarah michelle gellar,dylan baker,lawrence gilliard jr.,comedy drama fantasy romance,simply irresistible,chef female chef love magic restaurant,english
unknown_director,francis capra,jason dohring,enrico colantoni,crime drama mystery,veronica mars            ,best friend high school private detective sheriff student,english
john cameron mitchell,john cameron mitchell,miriam shor,andrea martin,comedy drama music musical,hedwig and the angry inch,band rock band sex change song transsexual,english
sheldon lettich,antoni corone,ryan bollman,todd susman,action drama,only the strong,capoeira fight fighting martial arts violence,english
jon knautz,rachel alig,monda scott,alexis kendra,drama horror mystery thriller,goddess of love,female nudity hallucination sex scene strip club stripper,english
billy ray,hayden christensen,rosario dawson,cas anvar,drama history,shattered glass,fabricated facts journalist stephen glass the new republic writer,english
david atkins,chelcie ross,lynne thigpen,polly noonan,comedy crime drama thriller,novocaine,dentist drugs murder sex sunflower,english
patrick stettner,stockard channing,tony devon,frederick weller,drama thriller,the business of strangers,airport businesswoman hotel revenge vegetarian,english
sam peckinpah,william holden,warren oates,l.q. jones,action adventure western,the wild bunch,friendship honor righteous rage soldier texas,english
jonathan levine,mary-kate olsen,aaron yoo,method man,comedy drama romance,the wackness,ice cream marijuana new york city summer therapy,english
michael crichton,lesley-anne down,michael elphick,pamela salem,adventure crime drama thriller,the great train robbery,bank gold key safe train,english
lynne ramsay,samantha morton,bryan dick,paul popplewell,drama,morvern callar,breasts cleavage female rear nudity girl in panties public nudity,english
sylvio tabet,michael berryman,kari wuhrer,marc singer,action adventure fantasy sci-fi,beastmaster 2: through the portal of time,beast beastmaster psychotronic sword and sorcery warrior,english
rick bieber,aidan quinn,kendrick cross,sammy nagi njuguna,biography drama sport,the 5th quarter,athletic training football practice funeral gymnasium man crying,english
claude chabrol,benoît magimel,nathalie baye,mélanie doutey,drama,the flower of evil,bordeaux election mayor pamphlet political thriller,french
shana feste,jennifer ehle,zoë kravitz,cara seymour,drama romance,the greatest,car crash loss self help group teenage mother title directed by female,english
wayne wang,bingbing li,russell wong,ji-hyun jun,drama history,snow flower and the secret fan,car hitting pedestrian china fan nineteenth century reversal of fortune,english
joey lauren adams,tim blake nelson,diane ladd,ritchie montgomery,drama romance,come early morning,church drink knocking on a door love three word title,english
peter cattaneo,james nesbitt,olivia williams,peter mcnamara,comedy crime romance,lucky break,escape prison prison escape sadism solitary confinement,english
fred zinnemann,meryl streep,jane fonda,vanessa redgrave,drama,julia,1930s female protagonist nazi romantic friendship writer,english
s.r. bindler,matthew mcconaughey,scott glenn,sarah wright,comedy,"surfer, dude",barefoot endorsement surfboard virtual reality waves,english
tony kaye,noam chomsky,pat buchanan,bill baird,documentary,lake of fire,abortion southern accent title based on the bible trial usa,english
greg marcks,henry thomas,barbara hershey,shawn hatosy,comedy crime drama,11:14,convenience store multiple perspectives murder paramedic van,english
perry lang,catherine bell,kevin tighe,tim guinee,action drama thriller,men of war,cockney accent fight island machismo mercenary,english
jake goldberger,pruitt taylor vince,m. emmet walsh,robert wahlberg,drama mystery thriller,don mckay,dead body dead body in a freezer dead body wrapped in carpet person in a car trunk school janitor,english
stefan ruzowitzky,charlie hunnam,olivia wilde,sissy spacek,crime drama thriller,deadfall,police officer police officer killed police officer shot sex scene,english
vic sarin,connie nielsen,aidan quinn,john bell,drama family,a shine of rainbows,island love new home orphan rainbow,english
william kaufman,drew waters,sean cook,cole hauser,action thriller,the hit list,die hard scenario engineer held at gunpoint race against time shot to death,english
unknown_director,romola garai,blake ritson,rupert evans,comedy drama romance,emma            ,friendship love triangle matchmaker naivety opposites attract,english
david cronenberg,debbie harry,leslie carlson,reiner schwarz,horror mystery sci-fi thriller,videodrome,cyberpunk hallucination illegality snuff film surrealism,english
cédric klapisch,romain duris,cécile de france,iddo goldberg,comedy drama,l'auberge espagnole,apartment erasmus language student trip,french
kate barker-froyland,anne hathaway,shawn parsons,li jun li,drama music,song one,musician number in title recording sibling,english
barbet schroeder,ryan gosling,chris penn,agnes bruckner,crime mystery thriller,murder by numbers,disposing of a dead body high school student murder sociopath teenage boy,english
martin koolhoven,yorick van wageningen,tygo gernandt,martijn lakemeier,drama history war,winter in wartime,horse nazi occupation resistance movement uncle nephew relationship,dutch
charles matthau,billy burke,michael jai white,bill duke,comedy crime thriller,freaky deaky,black panties bomb squad car bomb dynamite girl in panties,english
john frankenheimer,jeanne moreau,paul scofield,michel simon,thriller war,the train,art french german painting train,english
christopher m. bessette,mira sorvino,john billingsley,trieu tran,drama thriller,trade of innocents,angkor wat human trafficking sex slavery sex tourism,english
prachya pinkaew,jon foo,nathan jones,johnny nguyen,action crime drama thriller,the protector,die hard scenario elephant long take police sydney australia,thai
gary sinyor,sean pertwee,frank finlay,samuel west,comedy,stiff upper lips,class conflict edwardian era england sexual awakening spoof,english
unknown_director,simon bird,belinda stewart-wilson,james buckley,comedy romance,the inbetweeners            ,black comedy bully friend house practical joke,english
gurinder chadha,archie panjabi,parminder nagra,anupam kher,comedy drama romance sport,bend it like beckham,hinduism marriage engagement soccer team tradition,english
john sayles,miguel ferrer,edie falco,timothy hutton,drama romance,sunshine state,african american business coastline florida real estate,english
preston a. whitmore ii,wesley jonathan,wayne brady,eva marcille,action sport,crossover,african american basketball basketball movie critically bashed tv commercial,english
ashish r. mohan,asin,mithun chakraborty,johnny lever,action comedy,khiladi 786,car crash impersonating a police officer long lost brother marriage bureau suitor,hindi
jaume balagueró,jonathan d. mellor,pablo rosso,andrea ros,horror,[rec] 2,apartment apartment building blood sample crucifix zombie,spanish
stewart raffill,kayla jackson,alexis biesiada,kayla raparelli,musical,standing ovation,dance dream frog philadelphia pennsylvania snake,english
george roy hill,eileen brennan,robert shaw,ray walston,comedy crime drama,the sting,con con man courier long con murder,english
hugh hudson,alice krige,ben cross,john gielgud,biography drama sport,chariots of fire,athlete jew missionary olympic games race,english
darren grant,cicely tyson,kimberly elise,tamara taylor,comedy drama romance,diary of a mad black woman,comic relief diary kiss madea series state flag,english
scott hicks,noah taylor,armin mueller-stahl,nicholas bell,biography drama music romance,shine,abuse australia concert pianist piano,english
joseph gordon-levitt,joseph gordon-levitt,scarlett johansson,tony danza,comedy drama romance,don jon,camera focus on female butt cunnilingus new jersey oral sex reference to facebook,english
clint eastwood,clint eastwood,richard bull,john hillerman,mystery western,high plains drifter,gravestone gunfighter outlaw revenge small town,english
terry zwigoff,scarlett johansson,steve buscemi,t.j. thyne,comedy drama,ghost world,art class diner friend graduation high school,english
richard eyre,kate winslet,jim broadbent,kris marshall,biography drama romance,iris,alzheimer's disease book love novelist writer,english
william sachs,stephen macht,avery schreiber,angelo rossitto,comedy sci-fi,galaxina,alien android fem bot female android stars,english
christophe barratier,jean-baptiste maunier,françois berléand,gérard jugnot,drama music,the chorus,boarding school boy choir school teacher,french
émile gaudreault,paul sorvino,luke kirby,claudia ferri,comedy drama,mambo italiano,gay immigrant italian police police officer,english
james cox,alexis dziena,louis lombardi,franky g,crime drama mystery thriller,wonderland,murder police police investigation porn star robbery,english
spike lee,ruby dee,john savage,danny aiello,drama,do the right thing,black militant frustration pizza pizza parlor pizzeria,english
james toback,sarah michelle gellar,eric stoltz,joey lauren adams,comedy crime drama romance thriller,harvard man,basketball cheerleader college harvard philosophy,english
aki kaurismäki,jean-pierre léaud,kati outinen,jean-pierre darroussin,comedy drama,le havre,bar container illegal immigrant neighbor shoe shiner,french
gaspar noé,philippe nahon,albert dupontel,jo prestia,crime drama mystery thriller,irreversible,long take male frontal nudity revenge reverse chronology vengeance,french
hitoshi matsumoto,lindsay kay hayward,hitoshi matsumoto,shinobu terajima,comedy drama,r100,coma one word title spitting sushi swimming pool,japanese
rakeysh omprakash mehra,anupam kher,steven mackintosh,madhavan,comedy drama history romance,rang de basanti,freedom friend india student urination,hindi
collin schiffli,kim shaw,john heard,david dastmalchian,drama,animals,drug addict drug addiction drug use drugs junkie,english
george ratliff,jim gaffigan,cree kelly,mike eshaq,action comedy drama thriller,salvation boulevard,cross doused with gasoline pastor security guard shower,english
david wain,jon hamm,ken marino,ron silver,comedy romance,the ten,death mexico sabbath surgeon ten stories,english
shane meadows,bob hoskins,paddy considine,shane meadows,comedy drama,a room for romeo brass,betrayal family relationships friendship psychosis stranger,english
morten tyldum,aksel hennie,synnøve macody lund,julie r. ølgaard,crime drama thriller,headhunters,art thief male frontal nudity male nudity male star appears nude painting,norwegian
jon wright,russell tovey,richard coyle,bronagh gallagher,comedy horror sci-fi thriller,grabbers,bathtub eaten alive ferry boat lobster trap sprinkler system,english
michael mcgowan,campbell scott,adam butcher,gordon pinsent,comedy drama sport,saint ralph,boston marathon coma marathon miracles running,english
liv ullmann,samantha morton,jessica chastain,colin farrell,drama romance,miss julie,kissing someone's boot midsummer telling someone to shut up two word title valet,english
jeannot szwarc,teresa wright,bill erwin,george voskovec,drama fantasy romance,somewhere in time,hotel love love across time time travel time travel romance,english
rohan sippy,abhishek bachchan,bipasha basu,prateik,action crime drama thriller,dum maaro dum,airport drugs loss of loved one police title based on song,hindi
james wan,lin shaye,barbara hershey,leigh whannell,fantasy horror thriller,insidious: chapter 2,barricading a door injection in leg police detective supernatural taser,english
darren lynn bousman,emmanuelle vaugier,tony nappo,shawnee smith,horror mystery,saw ii,death detective nerve gas serial killer trap,english
dan trachtenberg,bradley cooper,john gallagher jr.,sumalee montano,drama horror mystery sci-fi thriller,10 cloverfield lane,alien bunker car crash kidnapping minimal cast,english
jeff tremaine,bam margera,steve-o,chris pontius,comedy documentary,jackass: the movie,alligator golf japan panda stunt,english
david f. sandberg,billy burke,amiah miller,gabriel bateman,horror,lights out,based on short film reference to avenged sevenfold reference to slayer switching lights on and off two word title,english
henry joost,johanna braddy,sprague grayden,christopher nicholas smith,horror,paranormal activity 3,animate object imaginary friend reference to macgyver whispering woman wearing only a man's shirt,english
stiles white,lin shaye,shelley hennig,daren kagasoff,fantasy horror,ouija,death of girlfriend funeral ghost ouija spirit,english
chuck russell,john saxon,heather langenkamp,jennifer rubin,action fantasy horror thriller,a nightmare on elm street 3: dream warriors,dream freddy krueger killer nightmare springwood ohio,english
joel edgerton,busy philipps,allison tolman,wendell pierce,mystery thriller,the gift,compulsive liar fired from a job gift rape substance abuse,english
eugenio derbez,eugenio derbez,jessica lindsey,hugo stiglitz,comedy drama,instructions not included,father daughter relationship,spanish
henry joost,matt shively,brendon eggertsen,alisha boe,horror,paranormal activity 4,boy in a bathtub demon laptop computer pulled underwater walking in the dark,english
henry koster,richard burton,jean simmons,victor mature,drama history,the robe,box office hit crucifixion nightmare palestine robe,english
blake edwards,burt kwouk,herbert lom,catherine schell,comedy crime mystery,the return of the pink panther,clouseau diamond panther pink pink panther,english
rachel talalay,johnny depp,tom arnold,yaphet kotto,comedy fantasy horror thriller,freddy's dead: the final nightmare,dark comedy dream freddy krueger nightmare serial murder,english
patty jenkins,charlize theron,bruce dern,pruitt taylor vince,biography crime drama thriller,monster,beach female criminal hooker lesbian prostitute,english
richard fleischer,james mason,robert j. wilke,paul lukas,adventure drama family fantasy sci-fi,"20,000 leagues under the sea",captain expedition sea submarine whale,english
christopher landon,richard cabral,gloria sandoval,molly ephraim,fantasy horror thriller,paranormal activity: the marked ones,apartment blood demonic possession neighbor pentagram,english
david lynch,anthony hopkins,anne bancroft,dexter fletcher,biography drama,the elephant man,curiosity exploitation freak hospital physical deformity,english
jean-marc vallée,matthew mcconaughey,jennifer garner,denis o'hare,biography drama,dallas buyers club,drugs fda gay community hiv homophobia,english
david gelb,olivia wilde,mark duplass,donald glover,horror sci-fi thriller,the lazarus effect,electrocuted experiment hell serum university,english
christopher nolan,callum rennie,thomas lennon,jorja fox,mystery thriller,memento,flashback memory murder short term memory telephone,english
mike flanagan,james lafferty,rory cochrane,garrett ryan,horror mystery,oculus,home office mirror released from a mental hospital trauma video camera,english
kevin smith,ethan suplee,jason mewes,brian o'halloran,comedy,clerks ii,fast food fast food restaurant new jersey quick stop restaurant,english
stephen daldry,julie walters,gary lewis,jamie draven,drama music,billy elliot,audition ballet boxing miner miners strike,english
nat faxon,steve carell,liam james,jim rash,comedy drama,the way way back,awkward boy shy kid summer vacation water park,english
george jackson,william schallert,tisha campbell-martin,helen martin,comedy drama music romance,house party 2,college misogyny money new friend party,english
george miller,tony bonner,jack thompson,tom burlinson,adventure drama family romance western,the man from snowy river,australia brumby ranch stallion twin,english
maurice joyce,frank welker,constance shulman,alice playten,animation comedy family,doug's 1st movie,dance friend monster reference to batman valentine,english
robert duvall,john beasley,todd allen,june carter cash,drama,the apostle,church louisiana minister preacher texas,english
frank perry,faye dunaway,xander berkeley,diana scarwid,biography drama,mommie dearest,abusive mother adopted daughter borderline personality disorder perfection sadistic cruelty,english
jesse peretz,zooey deschanel,adam scott,steve coogan,comedy drama,our idiot brother,art model farmer jail nude model three sisters,english
stephen hopkins,william hurt,tony curran,david kross,biography drama sport,race,1930s athlete nazi germany olympics track and field,english
ice cube,bernie mac,monica calhoun,chrystale wilson,comedy drama,the players club,catfight dominatrix rape spanking stripper,english
tim blake nelson,mekhi phifer,andrew keegan,john heard,drama romance thriller,o,basketball basketball player boarding school love shakespeare's othello,english
john erick dowdle,ben feldman,edwin hodge,perdita weeks,horror mystery thriller,"as above, so below",archeologist catacomb found footage paris france philosopher's stone,english
bille woodruff,boris kodjoe,cameron mills,sharon leal,drama thriller,addicted,adultery attraction lust obsession temptation,spanish
kasi lemmons,jurnee smollett-bell,lynn whitfield,diahann carroll,drama,eve's bayou,doctor louisiana secret title directed by female witchcraft,english
richard glatzer,kristen stewart,hunter parrish,seth gilliam,drama,still alice,alzheimer's disease bechdel test passed linguistics professor new york city reference to angels in america the play,english
michael curtiz,gene tierney,peter ustinov,jean simmons,drama history,the egyptian,afterlife egypt pharaoh princess pyramid,english
bruce malmuth,sylvester stallone,lindsay wagner,persis khambatta,action crime thriller,nighthawks,bomb new york city partner shooting terrorist,english
rob hedden,kane hodder,peter mark richman,scott reeves,adventure horror,friday the 13th part viii: jason takes manhattan,cult film friday the thirteenth hockey mask jason voorhees murder spree,english
joel zwick,nia vardalos,louis mandylor,lainie kazan,comedy family romance,my big fat greek wedding,baptism greek greek restaurant prejudice travel agency,english
harmony korine,james franco,heather morris,rachel korine,crime drama,spring breakers,kissing a dead body repeated dialogue sex in pool spring break twins,english
joe chappelle,donald pleasence,kim darby,mitchell ryan,horror thriller,halloween: the curse of michael myers,halloween michael myers nudity returning character with different actor slasher flick,english
alfonso cuarón,maribel verdú,daniel giménez cacho,maría aura,adventure comedy drama romance,y tu mamá también,beach cleaning a swimming pool male male kiss mexico on the road,spanish
edgar wright,peter serafinowicz,dylan moran,rafe spall,comedy horror,shaun of the dead,british horror pub record collection zombie zombie apocalypse,english
mickey liddell,jessica lowndes,randy wayne,haley bennett,drama horror thriller,the haunting of molly hartley,18th birthday birthday community center resurrection teenager,english
john sayles,matthew mcconaughey,clifton james,miriam colon,drama mystery,lone star,father son relationship interracial relationship neo western sheriff texas,english
dwight h. little,donald pleasence,kathleen kinmont,ellie cornell,horror thriller,halloween 4: the return of michael myers,halloween michael myers murder niece october,english
fred walton,thomas f. wilson,deborah foreman,clayton rohner,horror mystery,april fool's day,april fool's day island mansion psycho secret,english
barry levinson,steve guttenberg,daniel stern,ellen barkin,comedy drama,diner,baltimore colts diner marriage salesman wedding,english
steve carver,david carradine,william sanderson,robert beltran,action crime drama thriller western,lone wolf mcquade,drugs martial arts texas texas ranger weapon,english
gonzalo lópez-gallego,warren christie,ryan robbins,andrew airlie,horror mystery sci-fi thriller,apollo 18,cosmonaut footprint found footage moon secret mission,english
christine jeffs,clifton collins jr.,mary lynn rajskub,paul dooley,comedy drama,sunshine cleaning,business crime scene cleanup private school school sister sister relationship,english
john erick dowdle,sterling jerins,claire geare,sahajak boonthanakit,action thriller,no escape,asia fictional country hotel rebellion revolution,english
don coscarelli,vanna bonta,john amos,rip torn,action adventure fantasy,the beastmaster,breasts critically acclaimed female frontal nudity psychotronic film sword and sorcery,english
king vidor,gina lollobrigida,george sanders,finlay currie,drama history romance war,solomon and sheba,king pharaoh queen queen of sheba tribe,english
michael tiddes,fred willard,mike epps,russell peters,comedy,fifty shades of black,color in title parody reference to cuba gooding jr reference to netflix written by star,english
bill duke,eddie cibrian,jenifer lewis,wood harris,drama romance,not easily broken,african american protagonist based on novel title spoken by character,english
frank borzage,gary cooper,helen hayes,adolphe menjou,drama romance war,a farewell to arms,1910s ambulance driver italy lake nurse,english
bille woodruff,donald faison,brandy norwood,lauren london,comedy romance,the perfect match,unknown_keywords,english
mamoru hosoda,lara jill miller,colleen o'shaughnessey,mona marshall,action adventure animation family sci-fi,digimon: the movie,based on video game box office hit computer digimon internet,english
brian dannelly,macaulay culkin,patrick fugit,eva amurri martino,comedy drama,saved!,christian jewish pastor school virginity,english
denys arcand,marie-josée croze,stéphane rousseau,marina hands,comedy crime drama mystery romance,the barbarian invasions,cancer dying friend money socialist,french
richard lester,robert shaw,denholm elliott,nicol williamson,adventure drama romance,robin and marian,crusades friar robin hood sheriff sheriff of nottingham,english
j.s. cardone,brendan fehr,kerr smith,izabella miko,horror thriller,the forsaken,flashing breasts hitchhiker vampire vampire hunter virus,english
guy hamilton,harrison ford,carl weathers,franco nero,action drama war,force 10 from navarone,colonel mission partisan spy traitor,english
jay levey,fran drescher,gedde watanabe,michael richards,comedy drama,uhf,gambling imagination television television station tv show,english
nicholaus goossen,linda cardellini,joel david moore,shirley jones,comedy,grandma's boy,co worker game tester loss of virginity roommate snack,english
tamara jenkins,natasha lyonne,kevin corrigan,jessica walter,comedy drama,slums of beverly hills,flatulence menstrual blood nomad nursing school title directed by female,english
sergio leone,claudia cardinale,woody strode,jack elam,western,once upon a time in the west,gang gun harmonica killing woman in bathtub,english
jon favreau,jon favreau,faizon love,jonathan silverman,comedy crime drama thriller,made,friendship loudmouth money laundering new york city stripper,english
duncan jones,kevin spacey,matt berry,benedict wong,drama mystery sci-fi,moon,computer contract earth moon solitude,english
